flagstaff,Leather dining chairs,00W0W_iotujsquR4e,600
flagstaff,Upholstered chair,00j0j_cltAiQOQyTZ,40
flagstaff,Lg. Vintage Wood Coffee Table X Faux Bamboo legs,00L0L_fPsPhvPlXOU,85
flagstaff,Glass top dining table w/4 chairs,00O0O_6yrl68MZULS,450
flagstaff,Dinette Set $199,00S0S_5sJDPvT0so,
flagstaff,Memory Foam Mattress and wooden frame,00Z0Z_gXSXrKcsuE3,269
flagstaff,Pine Bookshelf,,102
flagstaff,IKEA Glass desk top only. IKEA GLASHOLM,00r0r_63kn43xcHr8,55
flagstaff,Guitar or bar stool - super solid,00O0O_bpPKOe6Wvyn,30
flagstaff,Beautiful Shabby-Chic Credenza,,180
flagstaff,C Jere,00c0c_9n2ByJPHRJf,300
flagstaff,Pair of Antique Twin Brass Beds,00M0M_2okGTeml6U5,150
flagstaff,World Market Papasan Chair (Frame and Cushion Included),00B0B_fqqNL0NB7oQ,60
flagstaff,Folding Chairs - Metal,00W0W_gNHivXju3xP,10
flagstaff,Oak Dresser With Mirror,01212_1wAxqcLgOxe,85
flagstaff,Antique Oak Desk,00J0J_4ked7q2f7rg,50
flagstaff,End table,01515_2qehGZD7C5j,30
flagstaff,Queen Double Pillow  Serta Top Mattress,00J0J_fiVmsHwhjTT,150
flagstaff,"Estate Furniture, Prices Reduced !",00V0V_4QQnfqDhMrJ,
flagstaff,"Sofa $325, Gifts, Furniture, Antiques and Collectibles !!",01010_bBht0RqkAlr,
flagstaff,CHEST OF DRAWERS,00a0a_6TAdWb99Y84,30
flagstaff,CHEST OF DRAWERS,00Z0Z_22fKCeh5p9y,40
flagstaff,Wooden Folding Mirror,00v0v_2zkFK0qSMXk,20
flagstaff,Dressers $199 each,00f0f_b4gwzOYS703,
flagstaff,Dressers $199 each,00M0M_4r3E0o25Dv2,
flagstaff,High Quality Stereo Cabinet,00S0S_2puRr6f4QFa,65
flagstaff,Moving Sale,00101_EZoVKQqYY8,25
flagstaff,"60"" Oak Curio Cabinet",00Y0Y_1oJrJ9tY15P,245
flagstaff,Large Ceramic Horse Head Wall Hangings,00x0x_gAMoo5R9mQ0,80
flagstaff,Beautiful Vintage 4 Post Bed Ball and Spindled Wood (Queen) Bed,00k0k_2AGuLB2ChD2,260
flagstaff,Curio Cabinet w/light,00k0k_59vcVayX0bk,290
flagstaff,Modern X-Shaped Coffee Table Base,00f0f_6V9q0XMTaMg,65
flagstaff,GLASS DISPLAY SHELF PANELS - LOTS OF THEM!,00d0d_kT7msBd8Lbw,15
flagstaff,LOWE'S NEW - Green Patio Chair Cushion for Chaise Lounge,00X0X_eA3UABmCPLA,70
flagstaff,Ashley Martini Entertainment Center,00j0j_3GxkVxCDgXl,495
flagstaff,Quality Karasten Wool Mahira Rug,01616_jYMXswpadFb,600
flagstaff,Love Seat,00m0m_fyD5coXHu6L,450
flagstaff,Amish Glider/Rocker Chair,01313_e7DpVZZm1tX,125
flagstaff,Amish Rocking Chairs,00606_6sh9baQdxLH,75
flagstaff,Cat Condo,00v0v_8IF9wVLJhPi,70
flagstaff,"Couches, chair, air conditioning unit, tables. Moving sale.",00i0i_22zrwJXsSEb,10
flagstaff,Twin bed,,100
flagstaff,Chase Lounge,00b0b_ltaH2Ja8VDC,250
flagstaff,2 patio sets,00X0X_7tVcOsNcwEv,150
flagstaff,ANTIQUE W H GUNLOCKE LEATHER SWIVEL DESK OFFICE CHAIR,00E0E_7CbCpuOkiOF,90
flagstaff,"""Goddess"" Vintage Wine Jug Vase Statue, Pedestal Table By: Universal S",00C0C_lVgRmNEuNbN,320
flagstaff,PAIR of MID CENTURY TRAVERTINE MARBLE DINING TABLE/ DISPLAY COLUMNS,00L0L_lbmNE4dBT3C,450
flagstaff,Comfort Deluxe Artist/Drafting Desk Office Task Chair,00n0n_b11FGiuruDA,80
flagstaff,NEW PRICE...! Dark Wood 8 Drawer Combo Dresser,00n0n_7eDj2zHLzAB,550
flagstaff,"ABSOLUTELY STUNNING 43"" Round Quartz and Granite Table Top",01515_aF08FmGAW1o,650
flagstaff,A Line Furniture Black Fabric Mobile Kneeling Posture Chair,00505_GzWfbuGbJD,250
flagstaff,Mid Century Style Modern Floating Glass Coffee Table,00a0a_bAxqYlA8mx2,460
flagstaff,BAMBOO BAR STOOLS,00D0D_eJktoVDr7UC,40
flagstaff,"Twin beds, kitchen table, rugs",00g0g_3iLw9b6CPWO,200
flagstaff,Lovely Antique Hall Tree By: Hekman Lexington. N C.,00h0h_kMpDcj6TaBZ,130
flagstaff,Designer Storage Chest Wood Trunk End Table,00808_9FxlAYDcuq4,120
flagstaff,Rare Vintage ARTS OF PARIS Huge Castle Statue Lamp,00g0g_iylxZ5Bs3n5,320
flagstaff,Vintage Imperial Furniture Co of Grand Rapids Coffee Table,00O0O_cuo4TAZTOFK,240
flagstaff,King size bed frame and dresser,00O0O_edQFq68FOnK,200
flagstaff,Oak desk set,00w0w_aY0bX7Hcvzm,150
flagstaff,Dining room table,00q0q_3wu0dKBNN0i,200
flagstaff,Love Seat and Oversized Chair (Camp Verde),00Q0Q_fWZ5RwD5Fr1,250
flagstaff,favorite this post Oak Dining Table and 6 Chairs - Peacock Theme,01515_gh98UdqLVyU,200
flagstaff,Hall table and mirror,00o0o_ebd6coGtfl5,20
flagstaff,KID KRAFT TODDLERS BED & MATTRESS  NICE .,00i0i_9Tzll49xlRE,35
flagstaff,NICE WROUGHT IRON 3PC PATIO SET LIKE NEW .,01414_egfAnzkcCPM,125
flagstaff,KID KRAFT TODDLERS BED & MATTRESS  NICE .,00i0i_9Tzll49xlRE,35
flagstaff,TWIN OR FULL STEEL BED FRAME .,00B0B_7mueEmirtJ7,25
flagstaff,liquidation sale.....                  room sets,00h0h_7W8aV4nXYY5,
flagstaff,Desk with shelves and cabinets,01717_3E2xf572ffu,50
flagstaff,Vintage Drexel Heritage Chinoiserie,00v0v_i5GEQIIt8h2,950
flagstaff,Vintage MCM Lamps For Sale Buy One Buy All Must Go Low Prices,00H0H_1o13z1Wg6W6,20
flagstaff,"Vintage MCM Pottery, Art And Accessories In Good Condition",00D0D_gZUIUk49mLY,1
flagstaff,Elegant Dining Table with 6 chairs,00n0n_4gwHCmRfUPY,350
flagstaff,Beautiful TV Hutch with shelves,00n0n_dGgA6AtfXLd,300
flagstaff,Mid-Century Danish Modern Swivel Rocker,00u0u_40iiw7cXn8h,375
flagstaff,Vintage Early Mid-Century Modern Swivel Rocking Armchair,00c0c_4RRgd4MtYTc,395
flagstaff,MCM Green Naugahyde Mad Men Swivel Rocker Club Chair,00101_4FAllQrSCdJ,350
flagstaff,Vintage Mid-Century Modern Bookshelf,00L0L_78rZgYpNAOD,90
flagstaff,Retro Mid Century Modern Brass & Vinyl Dining Chair,00l0l_1c8pT5ePQab,75
flagstaff,Vintage Mid Century Modern Upholstered Dining Chair,00q0q_dzter2S5AeX,75
flagstaff,Wooden Bench,00k0k_hNx6IduPpLf,120
flagstaff,Bedroom set,00Z0Z_3aM8LPD5ifD,300
flagstaff,2 Office Chairs Swivel aqua colored,00I0I_2bMQrqouQQS,110
flagstaff,Darcy Sage Sofa Chair By: Signature Design by Ashley,00S0S_g1SmKVRHjNx,220
flagstaff,Vintage Teleflora Orange ~ Ruffled Glass Pedestal Bowl ~ Gorgeous!!!,00k0k_7Y437NuptlQ,35
flagstaff,Gorgeous Formica End/Side Table,00K0K_crWSmxdFOzb,65
flagstaff,Zebra Art Deco Patio Deck Chairs...!!!,00q0q_j2WETLuiUfM,65
flagstaff,Mid-Century Hollywood Regency Round Swivel Glass Coffee Table,00w0w_2AiL2GaFENC,480
flagstaff,Gorgeous - Mid Century Hanging Dual Mirror,00I0I_2VvLiPmZDHT,180
flagstaff,Cool Gila Monster Art Painting on Canvas,00s0s_h44utQCj1j8,35
flagstaff,Beautiful Watercolor Framed Painting,00d0d_3IDjslBlqOT,60
flagstaff,Kids Little Outdoor Table (3)-Chair Set By: Adirondack,00G0G_8EKBMuAPRM9,40
flagstaff,Fancy (Chrome) Floor Standing Towel Rack,00N0N_aBFsYs0uEG4,70
flagstaff,Vintage Brass Decorative Sculpture...,00A0A_jynwwmlWJxN,45
flagstaff,Stunning Huge 54'' Tall Asian Floor Vase Urn,01616_nuKtg3drwk,1200
flagstaff,Art Deco Heptagon Mirror with Suspending Flowers,00E0E_4WsWx4fMTmd,85
flagstaff,NAC & ZAC X-large Bench Seat Pet Cover Protector with Harness,00P0P_gv4u1nD5JTG,55
flagstaff,Romeo Y Julieta Flip Top Cigar Display Case,00r0r_fhbfbBICB5K,30
flagstaff,PAIR Vtg Mid Century Modern Bundled Rattan Bamboo Tiki Table Lamps,00U0U_kNayXkcJxGn,160
flagstaff,Round End Pedestal Table,00x0x_g57N90PZQZi,85
flagstaff,Black Glass Standing Tower Shelf 4-Tiered with Cd/ Bookends,00i0i_bxt6uSw60sD,80
flagstaff,Charming Specialty Corner Cabinets,01515_iAiHlzPzuLy,160
flagstaff,X-Large Down Filled Tiger Print Pillow with Tassels,00W0W_bY6odLLi9BJ,80
flagstaff,Stunning Glass Top Etagere Accent Table,00m0m_dbRa3to6DiA,65
flagstaff,END TABLE,00S0S_lQuze68Mbca,20
flagstaff,Gorgeous Dining Table and Chairs with Glass Top!,00y0y_kamVqOzE23J,320
flagstaff,Crystal (Glass) Chandelier Prism Candle Holders,01212_8h1F7IxpT9q,65
flagstaff,WOOD CHAIR,00B0B_3wIrg6i5GSL,20
flagstaff,Dark Wood 8 Drawer Combo Dresser,00n0n_7eDj2zHLzAB,550
flagstaff,Nice Black and White Hobby Lobby Cushioned Storage Ottoman,00D0D_thkxJHKSzn,45
flagstaff,James Haddon Collection... Bookends-- Tabby Kitty Cats,00S0S_kNSSqZL6NiN,45
flagstaff,secretary desk claw feet,00D0D_8GqG0MxBYjL,300
flagstaff,Kokopelli Bike Riding Sandstone Art Sculpture,00707_kcUihEE0Kgh,35
flagstaff,2-Piece Large Round Porcelain Taco Serving Tray with Chili Peppers,00T0T_3cZoUz4w15p,45
flagstaff,MARK and GUTHERZ CARLSBAD AUSTRIA FLORAL 2 BONE DISHES,00505_jda583e0d08,25
flagstaff,Beautiful Ivory Leaf Shaped Fine China Relish Dishes,00505_dPnhHII6ve2,45
flagstaff,Funk and Wagnalls New Encyclopedia Hardcover with Gold Gilt,00a0a_22DTIyHY9aU,70
flagstaff,DREXEL VILLA ESCALANTE SPANISH MEDITERRANEAN STYLE ARMOIRE DRESSER,00Y0Y_fpvaqV6eKfA,480
flagstaff,Set/8 Chivas Regal Scotch Gold Crest Emblem Rocks Lowball Sipping Bar,00o0o_5qehtkuDsZt,45
flagstaff,Fancy (Brass) Floor Standing Towel Rack,00808_hSjRT90ZWa1,80
flagstaff,BEAUTIFUL RUSTIC LOG SIDE/END TABLE,00N0N_3frFLogUgku,140
flagstaff,Milo Baughman Mid-century Modern Expandable Brass Etagere,00I0I_iPROPV9icwR,850
flagstaff,Flat Screen TV,01414_8T3F4AzvvEv,100
flagstaff,Headboard and Bed,00Y0Y_dN3HWdPSxy7,60
flagstaff,Armoire,00W0W_lvaC6P0ee7L,60
flagstaff,Storage Basket Shelves,00909_laR1mL28PZs,75
flagstaff,Office Chair,00505_eHrTdRS1Qsw,25
flagstaff,Desk Blotter,00z0z_c2wh5alk0qD,20
flagstaff,western saddle bar stool,00l0l_hQZdBZ4Sb7c,100
flagstaff,Reclaimed wood furniture and decor,01717_iQ12RKDJ6Iu,
flagstaff,Vintage Magnavox Astro-Sonic,00Y0Y_l7hWfThDxvN,150
flagstaff,Table and Chairs,00v0v_i3eDe0ZbqCS,80
flagstaff,Wrought iron outdoor patio chairs and tables,00909_jj5y5V2vFuP,50
flagstaff,Oak Rolltop Desk with many nook drawers,00d0d_3a8ftiJg5qr,110
flagstaff,Walnut colored armoire with two drawers,00c0c_aM4t1zRIKGK,50
flagstaff,COUNTRY TABLE,00W0W_XuwJjow8JS,300
flagstaff,Dining Table,00909_3HmDCDjIS8r,30
flagstaff,3 Oak Bar Stools,01313_i9JaB05QXqb,60
flagstaff,HANDMADE TWIN SIZE BEDS,00S0S_glVOmxT0bjX,900
flagstaff,Milo Baughman Tri Level Chrome & Glass Swivel Coffee Table,00I0I_90nNadNycG5,995
flagstaff,STONE TOP TABLE.,01212_6z7ubzfLWa3,80
flagstaff,Nice Large Wall Mirror,00k0k_7MYVbcUwnjc,40
flagstaff,Gold Frame Vanity Mirror,00e0e_aYAXADBCKyx,30
flagstaff,Ikea Poang Chairs Armchair and Footstool Set,00909_2V7D4SvcxU7,180
flagstaff,CHAIR,00V0V_2AHaPhh6aAv,15
flagstaff,"FRAMED MIRROR 48 X 36""",00F0F_grtXQYKzU91,250
flagstaff,BEAUTIFUL GLASS TOP TRAVERTINE MARBLE CONSOLE TABLE,00808_ncdrdHvCAz,180
flagstaff,Like new Recliner,00v0v_k9ca0oigoCe,150
flagstaff,King Size Mattress,00R0R_4p0Vi23214K,100
flagstaff,Like new Recliner,00X0X_8kLuCcl7E0b,150
flagstaff,GRANITE TOP SIDE TABLE,00000_7iDLPvRRKX5,90
flagstaff,King Size bed bed frame,,20
flagstaff,Bar stool,00101_7M9cShZG161,25
flagstaff,Large Mirror,00T0T_aPD0Mafasck,30
flagstaff,Custom log bar stools,00A0A_i5YBxiTGxhh,175
flagstaff,2 Oak Bookcases - sold separately,00N0N_9nvcyWBWxYI,25
flagstaff,Dining Room Table,00Z0Z_9Cac4lvZuMb,500
flagstaff,TV Stand / Console,00F0F_iBGN8Wb3QoC,150
flagstaff,Round Coffee Table,01313_kpnhthtnN6O,60
flagstaff,Ashley Leather Sectional,00c0c_1raRsKFVaTT,700
flagstaff,Beautiful Dining Chairs,00P0P_1WOZUB2c2C5,160
flagstaff,Gorgeous 54'' Round Beveled Glass Top 3/4'' Thick,00m0m_bPxAqUXY0Oo,360
flagstaff,Couch Set (Couch & Love Seat),00F0F_59v9UVoS7YG,500
flagstaff,Shabby Black Wall Coat Rack,00t0t_lCkw05XkKTq,40
flagstaff,Oak Side Table w Drawer,00W0W_hzml55KCl7w,22
flagstaff,White Night Stand w Mirrored Front Drawer,00E0E_6ClzQjjPwTa,24
flagstaff,Mexican Tin and Tile Mirror,00p0p_cuXfgh3aNy2,65
flagstaff,Stone and Metal Table,00m0m_48h4sWCdi3q,33
flagstaff,Black and Blue Asian Dresser,00n0n_ijAJBUxasbE,29
flagstaff,Rusty Metal Trunk Coffee Table,00g0g_hQ7pNFZ3SUK,50
flagstaff,Dark Wood End Table w Drawer,00N0N_4kS4nfItOZw,35
flagstaff,Trendy Bar Stool,00Y0Y_eNrvzLOBhYc,27
flagstaff,Shabby White Wall Curio Cabinet,00202_dbjtkzRxZhy,65
flagstaff,Primitive Wood Bench,00202_fpnQZfS3dbi,45
flagstaff,Chippy White Iron and Glass Shelf,00Y0Y_6J4iObzTGXN,135
flagstaff,French White End Table w Drawer & Decoupaged Top,01313_k0suTGlYbEj,45
flagstaff,Chippy Primitive Mexican 6 Drawer Wardrobe,00J0J_lbhFLWfd39g,250
flagstaff,Mexican Pine Coffee Table w Barley Twist Edges,00r0r_97Uw38YyTPZ,149
flagstaff,2 Drawer Wood Stand w Wicker Drawers,00w0w_fpSuDFwnePE,65
flagstaff,DIY Clothing Armoire Project Piece,00p0p_gf3PVp8aa0p,28
flagstaff,Rustic Driftwood and Blue Side Table,00k0k_97Xt9AH6NQf,45
flagstaff,Shabby Blue Antiqued 4 Drawer Writing Desk,00X0X_8us9lbaE5B3,130
flagstaff,Black Shabby Solid Wood Side Table w Pewter Handle,00U0U_aaT9nqYe6vB,68
flagstaff,Small Dropleaf Side Table,00909_j7Nzz1fRtDW,65
flagstaff,Rustic End Table,00v0v_2m6ZkWUgzta,35
flagstaff,Brown Corner Shelf,00O0O_jzodu6Dv2T3,58
flagstaff,Rustic Barn Red & Wood 6 Drawer Dresser,00n0n_l1NOaTZDtF3,175
flagstaff,Large Acanthus Leaf Print Tufted Wingback Chair 1of2,01515_74CLXini8nm,149
flagstaff,Bronzed Metal Floor Lamp w Scalloped Glass Shade,01212_2BD2Vn0lWfM,69
flagstaff,Set of 3 Rustic Log Barstools,00L0L_irYlgqdqIY3,120
flagstaff,Teal Heart Bench,00o0o_loo8sCcPFoP,55
flagstaff,Southwestern Style Oak Side Chairs,00w0w_czRiwoREkZ4,22
flagstaff,Modern Wood Cabinet,00808_lFzkXiP4tiX,69
flagstaff,Wooden Side Table w Glass Top,00202_lAUmqoWeBPq,33
flagstaff,Modern Angled Upholstered Chairs,00u0u_29UMwJ9ufe7,79
flagstaff,Wooden Board Game Table w Checkers,00808_e8iXdR6Wc2M,48
flagstaff,Wood Etegere w Brass Plant Container,00g0g_bGREItHKcip,45
flagstaff,French Bistro Side Table,01212_gj2WO3gM5Cr,27
flagstaff,Rustic End Table,00F0F_2oqnfRtHA3e,35
flagstaff,Secretary End Table,00c0c_7e2W6ao0qRU,30
flagstaff,Mission Oak Coffee Table,01010_3Fqmmr81vm5,75
flagstaff,Pair of Tall Back Oak Side Chairs,00n0n_gtKTzpYdtcC,95
flagstaff,Set of 4 Burlap Dining Chairs,00f0f_esePLyGrsNH,125
flagstaff,Formica Topped Wooden Cabinet w 2 Drawers,00p0p_iXTiL4v5gYp,30
flagstaff,Brass Display Rack,00E0E_1kMuHaL6dkG,30
flagstaff,Oak Ice Box Style Table,00T0T_fshmIo90lr8,99
flagstaff,Black Metal Shelf,00404_2HEBxV6S2Vj,30
flagstaff,Shabby White Full/Queen Headboard,00O0O_59Mz5WmRprW,85
flagstaff,Carved Front Coffee Table w Glass Protector,00y0y_k8L2x2JJWSR,30
flagstaff,3 Door Black Storage Cabinet,00v0v_btS8xZIZ1NO,99
flagstaff,2 Drawer Nightstand,00j0j_682ag24PRlv,25
flagstaff,Solid Wood 6 Drawer Dresser,00909_La1J8JdQlZ,75
flagstaff,Oak Upholstered Stool,00O0O_1NypcOeDQew,25
flagstaff,Solid Maple Barrel Chair,01111_3W4lxD65E6S,19
flagstaff,Solid Maple Painted Black Vanity Desk,00q0q_j70Pro0yJvX,159
flagstaff,White Shabby Base w Stained Top Dining Table,00g0g_i7zgSmrwYee,129
flagstaff,Black Shabby Magazine/Craft Stand - Solid Wood,01111_gozEzmCY8HG,59
flagstaff,Solid Wood 4 Drawer Chest of Drawers,00E0E_aCvZFt8golb,119
flagstaff,Shabby Black Kneehole Desk,00606_35YekFmO4i2,149
flagstaff,Broyhill Sage Green Console Table,01616_6oogPGQqrvz,139
flagstaff,21 Cushioned Comfortable Chairs,01313_j8SS5XAdPbq,
flagstaff,4 Kindel Furniture Co. dining chairs,00c0c_872jrNjzlKy,50
flagstaff,Petite Solid Cherry Hutch Buffet,00M0M_i59YM7ayr0B,199
flagstaff,Sofa and matching recliner,00C0C_8iPaGlPWKt5,200
flagstaff,Sofa and matching recliner,00C0C_8iPaGlPWKt5,200
flagstaff,Tempurpedic bed,00D0D_6EJSv6dPIwp,500
flagstaff,White Drexel Victorian Style Side Table with Wood Top Solid Wood,00H0H_22ihVV53Etj,45
flagstaff,Black Metal Twin Bed - Headboard and Footboard,00y0y_gl6OgZVjDEM,20
flagstaff,Adorable Glass and Metal Side Table Plant Stand,00i0i_jaxxmd5SByq,25
flagstaff,Heavy Solid Wood Twin Size Headboard,00505_l37cMW2FzU4,30
flagstaff,Vintage Kroehler Permanized Side Table Nightstand w/ Drawer,01111_c0yKKpHHmmV,20
flagstaff,Dark Solid Wood Side Table or Nightstand,00c0c_1BcNN4kQRAq,35
flagstaff,Adorable Black Metal Oval Mirror with Spiral Detailing,00101_bQRS1siYsW2,20
flagstaff,Teal Blue Handmade Rustic Solid Wood Step Stool,00K0K_ev8MtiNVzdj,20
flagstaff,Large Rustic Solid Wood Bookcase,00L0L_j6rEI6aPiKW,30
flagstaff,Black Wood Side Table with Wrought Iron Base,00h0h_5U0r9L1MJOX,30
flagstaff,"2 wrought iron stools, leather covered seats",00q0q_7NDL7ZnhAv8,165
flagstaff,Really nice Solid Oak Table,00c0c_eGlHDPmC1on,80
flagstaff,Internally lit Curio Cabinet,,800
flagstaff,FOUR DRAWER LEGAL SIZE METAL FILE CABINET,00101_hejq3mO1MfW,25
flagstaff,Contemporary Glasstop Dining Set by Minson,00V0V_9UeBgRNGGG4,1500
flagstaff,"High End Minson Barstools 30"" Counter Bar Stools",00K0K_692lZ0796N2,100
flagstaff,Full Size Mattresses and frame,00F0F_6OcLcuR10EJ,200
flagstaff,Massage table,00707_19QZaXAYRn9,20
flagstaff,Hutch/tv stand need it gone,00w0w_iuV3Gxj7YRe,20
flagstaff,Solid Oak table,00p0p_2BoMw4WQ2ft,60
flagstaff,comfortable reclining couch With cop holders,00D0D_fTlcU1q5WFZ,600
flagstaff,Ikia style bed. I don't have email capability. Call or Text,00b0b_Ik88pU2D7t,110
flagstaff,nice desk/table,00505_bSe3Yf46eJH,
flagstaff,KID KRAFT TODDLERS BED & MATTRESS  NICE .,00i0i_9Tzll49xlRE,35
flagstaff,CUIRO CABINET CUSTOM MADE NICE .,00P0P_acvCTeDksq7,55
flagstaff,Simmons Beautyrest full size matress and boxspring.,00f0f_kRHmvfL1bPn,95
flagstaff,Southwest designer lamp w/ leather shade,00s0s_hwfbwcAIZ5N,175
flagstaff,Dining table and chairs/benches,00x0x_7h2ddEUEjUN,495
flagstaff,TWIN OR FULL STEEL BED FRAME .,00B0B_7mueEmirtJ7,25
flagstaff,RICH SOLID PINE DRESSER MIRROR,00G0G_kB3QNRBNp4W,30
flagstaff,Desk Executive Custom Rustic  Mesquite,00B0B_hjyzE0z4DrB,3200
flagstaff,Dresser / Chest Ostrich Leather,01313_heDv62bhP5X,2950
flagstaff,King Bed w/ Night Stands,00x0x_gZYMV2a6bzV,5500
flagstaff,Accent Chairs Designer Drexal Heritage New,00O0O_8CB5zCmdBMX,750
flagstaff,Glass Top Table Southwest,00303_1H3kYjuQdKE,1200
flagstaff,Occasional Table with Petrified Wood Top,01616_hVcYtQjNTSc,1250
flagstaff,Pedestal Lighted for Display,00909_kugAG4hsDvU,1050
flagstaff,Entertainment Stand / Media Console / TV Stand Tigerwood Copenhagen,00G0G_5pWrvYJDACq,675
flagstaff,Console Table / Sofa Table Juniper,00j0j_bCK2H6wSxs5,650
flagstaff,Furniture for sale,00f0f_gNNV09Rs76a,
flagstaff,Recliner,00G0G_kwy4rw5VXpT,60
flagstaff,Dining Table and 4 Chairs,00F0F_h45JHlKZWMV,175
flagstaff,5 Drawer Chest,00Z0Z_2zmU6SEMjIn,75
flagstaff,6 foot tall bookshelf,00e0e_c3d459cZ9gJ,30
flagstaff,Day bed,00I0I_90wfgrO8Ovl,70
flagstaff,Wrought iron daybed and trundle,00I0I_90wfgrO8Ovl,110
flagstaff,Sectional,,800
flagstaff,"CHINA CABINET from Martin Furniture co.""Blue Blazes Line"" Early 1900's",00y0y_eBWHA28c6Z,450
flagstaff,Unique Tiki Wooden Spoons with Crocodile,00k0k_aH6OT6L17l3,35
flagstaff,1981 Journey Captured First Album Cover Original Mirror S. Mouse Night,00S0S_kJoPQvcQ5QE,80
flagstaff,Beautiful Elongated Octagonal Shaped Glass Top - 3/4'' Thick!,00a0a_lguLx4nPiFf,160
flagstaff,Wysocki Folktown 6 plate collection with shelf by Charles Wysocki,00o0o_5XSS5mecBqc,60
flagstaff,Bunk Bed Ladder,00y0y_9xBCb6PTFLz,30
flagstaff,Pair of Stunning Italian Dining Chairs By: A. SIBAU,00w0w_fS52U9xDfip,120
flagstaff,Classic Rope Woven Wooden Accent Chair,00l0l_87UIJRm4rxT,45
flagstaff,GORGEOUS OAK PRESSED BACK SWIVEL OFFICE DESK CHAIR,00S0S_jQ30tMQsNx6,180
flagstaff,Pair of Gold Vintage COSCO Fashion Fold Chairs,00303_kZI6VzUAeya,70
flagstaff,Arched Bamboo Glass 2-Piece Display Shelf / Etagere,00Z0Z_8OT1LDYmkQr,145
flagstaff,Elegant Round Wood Pedestal Hall Entry Sofa Table,00n0n_ivO2THJKcjj,100
flagstaff,Novelty Goodies !,00l0l_iqCCfnvMxaQ,60
flagstaff,TWO BENTWOOD BAMBOO BAR STOOLS,00D0D_eJktoVDr7UC,40
flagstaff,Large 20'' Banana Leaf Round Serving Basket Tray,00s0s_7oI6TO3dSE5,30
flagstaff,Artsy 28'' Handcrafted Ceramic Bottle Vase W/Flowers,00t0t_9Npt1r3civF,55
flagstaff,GE Ultra Thin Line 21'' Fluorescent Under-Cabinet Light Fixture,01313_1xhZvrtFb02,35
flagstaff,Nice Decorative Home Decore Items,00D0D_86TYTBxKB0N,45
flagstaff,McGuire San Francisco Ventana Console Table,00404_5pCrzPskR7c,2600
flagstaff,Lift Chair - Blue - Very nice condition,01515_9JSyiFGOCeo,100
flagstaff,Dining room table for 6,00l0l_6SV59dsl77g,75
flagstaff,Hand painted cabnits,00i0i_lN0GFmSlith,125
flagstaff,King pole bed,00m0m_am7ZGqnGCPJ,850
flagstaff,FURNITURE  etc FOR SALE Prices Reduced,00c0c_4N1uEczIkrs,
flagstaff,Sofa,,150
flagstaff,bathroom cabinet and sink,00O0O_eBWx6zG2tzs,25
flagstaff,Box Spring,,15
flagstaff,"48"" OUTDOOR TABLE",00s0s_4NbTIp9hMAd,35
flagstaff,Mid Century Modern Coffee Table & Side Table Set,00T0T_bux1h8AlkA1,145
flagstaff,Mid-Century Modern Ottomans,00g0g_cVtdspD6oHs,65
flagstaff,1966 Mid Century Modern 3 Drawer Sleek Tall Dresser by Kroehler,00i0i_eESTbBPbot,195
flagstaff,ARMOIRE,00o0o_7oKhBugYmmF,140
flagstaff,Mid Century Danish Modern Folke Ohlsson Spindle Back Lounge Chair,00404_jv54sB11g33,295
flagstaff,LANE RECLINING LOVESEAT- custom ordered fabric- EXCELLENT CONDITION,00R0R_5ZQ6Y70UeU0,180
flagstaff,Four Dining Chairs for Sale,00q0q_lGt644gV3Bd,10
flagstaff,Display cases for sale-closing my retail shop,00L0L_8mTWFKUAIpR,100
flagstaff,Rolling office chair,00O0O_1IJQ2jDJH0K,35
flagstaff,Display cases for sale-closing my retail shop,00P0P_kWqLPOLCISx,100
flagstaff,Sofa / Couch,00x0x_8EEV7TCrhQL,50
flagstaff,Sofa & Arm Chair set from Macy's,00N0N_gM4BoBSKjkb,575
flagstaff,3 Modern Mid-Century Modern Barstools,00C0C_cnZ4FRpNFh4,150
flagstaff,Computer Desk,00G0G_d3BAKBBrGs7,49
flagstaff,Platform Storage Bed Twin XL Expresso,00f0f_4mOjIpFy9tz,250
flagstaff,Oak Farmhouse Table And 6 Oak chairs,00m0m_8mZVhUTssY5,260
flagstaff,"Oval Oak Dining Table, Leaf, 4- Oak Chairs",00202_90IaBcCqJMu,230
flagstaff,Nice Oval Oak Dining Table With 4 Tall Oak Chairs,00K0K_i70ZfcuG2NC,235
flagstaff,"Oval Oak Dining Table, Leaf, 6 Oak Chairs",00M0M_82jaVm3YOdc,265
flagstaff,Large Oval Oak Dining Table and 6 Tall Oak Chairs,00T0T_6v8UCukieEZ,275
flagstaff,Nice Farmhouse Table and 4 Oak Chairs,00J0J_4zVAsJlmJMX,141
flagstaff,"Serta Perfect Sleeper Aberdeen Queen Mattress, Box Springs and Frame",00z0z_8FFjAWqV4B3,250
flagstaff,Padded chair,00g0g_cSPUPBg2EuZ,5
flagstaff,Antique Sleigh Bed W/ Clean Mattress,00o0o_eufPPLy38EQ,150
flagstaff,Day bed,00h0h_30frO88MSzk,15
flagstaff,"Serta Perfect Sleeper Mattress, box springs and frame",,250
flagstaff,"KING SIZE MATTRESS, ONLY 1 MONTH OLD",00G0G_bRfjNBKi6Vo,350
flagstaff,1930's Parsons Table,00v0v_7rJPlBqOrnJ,325
flagstaff,Queen Canopy Bed Frame,00Q0Q_bGfReTeffSi,300
flagstaff,Wooden Vanity,00T0T_iGnBAuepmJk,
flagstaff,Brown Leather Couch and Chair (Fairchild Fine Furniture),00202_l0xcVTGtvSj,400
flagstaff,DISPLAY CASE hand made,00G0G_aCltypdqPDb,175
flagstaff,Blue twin trundle bed with night stand,00f0f_hKVydq52KVO,100
flagstaff,"Proffesional Grade Laminate Office ""U"" Desk",00p0p_cK06YDzE6B8,100
flagstaff,KID KRAFT TODDLERS BED & MATTRESS  NICE .,00i0i_9Tzll49xlRE,35
flagstaff,NICE WROUGHT IRON 3PC PATIO SET LIKE NEW .,01414_egfAnzkcCPM,125
flagstaff,Edwardian Style Desk- SOLID!,01010_5x1MjHiuZL5,100
flagstaff,Hillsdale barstool,00l0l_dTroijIbRSg,55
flagstaff,BEAUTIFUL ROLL TOP DESK,00Y0Y_e0CimSeS4wY,250
flagstaff,Platform twin bed,00n0n_fBx4oOgQTQM,65
flagstaff,9' Olhausen Pool Table,00T0T_3bGLJqNaul6,700
flagstaff,Bright Silver Plant Stand or Book Table,00S0S_33X3fTrDdoM,30
flagstaff,Bellingham Breakfast Table and Chairs,00P0P_2EMWgexU1r5,100
flagstaff,Lazy Boy Sofa and Love Seat Recliners,00m0m_8uVYsthmavE,525
flagstaff,Contour Chair Vintage Mid Century Electric Recliner,00b0b_45vshbmkVDo,90
flagstaff,Sectional sofa,00R0R_2BZFGivy8Jd,350
flagstaff,High End GENUINE ELK ANTLER Living Room Tables for your Lodge/Cabin,00G0G_jt5U8fBjbk3,1
flagstaff,Mission Style Oak Office Wall Unit w/Lateral Filing Cabinet,00M0M_6evCvB2ejb8,590
flagstaff,BULLETIN BOARDS,00404_baYterD2jfn,20
flagstaff,Quisco Chilean Pine/Cactus armoire/cabinet,00707_7xWP4tIb9Tu,400
flagstaff,Antique Walnut Gate Leg Drop Leaf Dining Table,00o0o_8vjuPPhW3xt,75
flagstaff,Antique Sewing Machine Table for Project (machine and drawers gone),00k0k_bnvU1C0sXMw,20
flagstaff,Unique Mid Century Corner Table w/Drop Leaf Maple,00k0k_6DbqsHeSDF1,75
flagstaff,"CASH ONLY Oak platform bed, storage drawers, dresser",00H0H_2Vw1FcYeUNY,700
flagstaff,Lazyboy sofa and loveseat- free to pick up,,
flagstaff,Couch,00c0c_aKu3hchmDay,175
flagstaff,cool furniture chair,00S0S_5TAq1Fitqxd,125
flagstaff,furniture cabinet for clothes,01313_45RwkFN1Hb,150
flagstaff,furniture closet,00606_lemtfcZQPh,150
flagstaff,Coffee Tables for Sale,00d0d_3B1VWmMgWfA,75
flagstaff,Bedroom Furniture for Sale,00E0E_a131lsaBDnB,500
flagstaff,SHELVES. SOLID OAK,00K0K_1RlhFlAslJQ,200
flagstaff,Modern Chic Coffee Table Reclaimed Wood,00N0N_7uJm1HOsOLH,400
flagstaff,New couch,00E0E_6sDawq6KUrv,600
flagstaff,Patio set,01313_je6Jyv1QldO,175
flagstaff,NICE STEEL BED FRAME FOR TWIN OR FULL SIZE .,01717_erQKhY68JrP,25
flagstaff,Wood Dining Table Set with 4 Chairs,00202_9Xdg5hjsIcu,150
flagstaff,Large TV Armoire,00I0I_lOUQva0jUa4,230
flagstaff,"Mid Century Modern Lane Walnut ""Alta Vista"" Side Tables",00d0d_gaa5lE3mFI1,125
flagstaff,Mid Century Modern Minimalist Lane Square Side Tables,00Z0Z_l9lzYvWenqZ,145
flagstaff,Mid Century Modern Danish Style Mersman Coffee Table,00f0f_7KTWEybH92m,70
flagstaff,Mid Century Modern 3 Legged BOOMERANG ATOMIC Corner Table,00X0X_2yDsUO2qJip,75
flagstaff,Mid Century Modern Danish Square Teak Coffee Table,00s0s_j7jGpPrVfPg,125
flagstaff,Mid Century Modern Pair of American Walnut Club Chairs,00b0b_gSYvfQC5mbK,295
flagstaff,Beautiful Antique Oak Kitchen Table with 4 Chairs,00202_3wtozKW0LD1,175
flagstaff,Theatre Chairs,,285
flagstaff,Oak Display/Sales Cabinate,00X0X_eA6P5zuqSW4,600
flagstaff,"BISSELL Little Green Portable Spot and Stain Cleaner, 1400M -",00c0c_c6n5J9E4wSw,40
flagstaff,Counter height bar chairs- stools 4,01515_k4TX6ZTu9rE,80
flagstaff,Mexican Wine cabinet,00505_ecJ2Yu5FLvS,100
flagstaff,Glass top wooden table,00606_liyUEYdGPM3,100
flagstaff,Decorative Urns,01717_5xjPXpIeD7p,20
flagstaff,"Hearedon Hutch, Mid-Century Grape Style Talble and 8 Chairs, and Antiq",00L0L_jsR3fPMY4YS,
flagstaff,White Sofa w/ Throw Pillows,00c0c_4N1uEczIkrs,60
